{
  "schema_version": 1,
  "scene_id": "blender_five_objects",
  "source": "source.png",
  "table": {
    "dimensions": [
      0.6,
      0.5,
      0.02
    ],
    "top_z": 0.2,
    "rgba": [
      0.87,
      0.86,
      0.82,
      1.0
    ],
    "friction": [
      1.2,
      0.01,
      0.001
    ]
  },
  "objects": [
    {
      "id": "pen_1",
      "name": "Black pen",
      "dimensions": [
        0.14,
        0.009,
        0.009
      ],
      "position": [
        -0.087,
        -0.167,
        0.20500000000000002
      ],
      "quaternion": [
        0.9998476951563913,
        0.0,
        0.0,
        0.01745240643728351
      ],
      "rgba": [
        0.035,
        0.035,
        0.035,
        1
      ],
      "image_bbox": [
        0.058,
        0.766,
        0.455,
        0.803
      ],
      "details": "Black pen; rounded edges and visible rigid details, no text/logo reconstruction."
    },
    {
      "id": "can_1",
      "name": "Soda can",
      "dimensions": [
        0.06,
        0.06,
        0.115
      ],
      "position": [
        0.105,
        0.07,
        0.258
      ],
      "quaternion": [
        1.0,
        0.0,
        0.0,
        0.0
      ],
      "rgba": [
        0.72,
        0.73,
        0.72,
        1
      ],
      "image_bbox": [
        0.631,
        0.221,
        0.975,
        0.413
      ],
      "details": "Soda can; rounded edges and visible rigid details, no text/logo reconstruction."
    },
    {
      "id": "case_1",
      "name": "Earbud charging case",
      "dimensions": [
        0.055,
        0.032,
        0.023
      ],
      "position": [
        0.033,
        -0.14,
        0.21200000000000002
      ],
      "quaternion": [
        0.7372773368101241,
        0.0,
        0.0,
        0.6755902076156602
      ],
      "rgba": [
        0.94,
        0.93,
        0.88,
        1
      ],
      "image_bbox": [
        0.522,
        0.724,
        0.662,
        0.854
      ],
      "details": "Earbud charging case; rounded edges and visible rigid details, no text/logo reconstruction."
    },
    {
      "id": "cover_1",
      "name": "Tablet cover",
      "dimensions": [
        0.29,
        0.19,
        0.012
      ],
      "position": [
        -0.045,
        0.03,
        0.20650000000000002
      ],
      "quaternion": [
        0.8703556959398997,
        0.0,
        0.0,
        -0.49242356010346716
      ],
      "rgba": [
        0.49,
        0.49,
        0.41,
        1
      ],
      "image_bbox": [
        0.003,
        0.123,
        0.751,
        0.726
      ],
      "details": "Tablet cover; rounded edges and visible rigid details, no text/logo reconstruction."
    },
    {
      "id": "gum_1",
      "name": "Gum container",
      "dimensions": [
        0.06,
        0.05,
        0.09
      ],
      "position": [
        0.12,
        -0.09,
        0.2455
      ],
      "quaternion": [
        0.9975640502598242,
        0.0,
        0.0,
        -0.0697564737441253
      ],
      "rgba": [
        0.08,
        0.35,
        0.19,
        1
      ],
      "image_bbox": [
        0.714,
        0.622,
        0.979,
        0.769
      ],
      "details": "Gum container; rounded edges and visible rigid details, no text/logo reconstruction."
    }
  ],
  "notes": [
    "Real user-supplied phone photograph, published at the user request. Approximate local agent-authored geometry, not image-to-mesh reconstruction.",
    "Scale uses an assumed 14 cm pen. Sizes, mass and friction are not measurements.",
    "Preserves the previously approved 3 cm pen displacement toward the bottom of the source photo.",
    "Boxes are replaced by rounded, multi-part visual models; one convex hull per object remains a collision approximation.",
    "No manual Blender review of this new version has been recorded; final confirmation remains pending."
  ],
  "source_sha256": "33bc3195d7b70d8cfb4a6940f770bfb060d9e886e0008bedabe8fbb9a9d5e259"
}