{
  "schema_version": 1,
  "scene_id": "open_rigid_objects",
  "source": "source.png",
  "table": {
    "dimensions": [
      0.8,
      0.6,
      0.02
    ],
    "top_z": 0.2,
    "rgba": [
      0.86,
      0.84,
      0.78,
      1
    ],
    "friction": [
      1.2,
      0.01,
      0.001
    ]
  },
  "objects": [
    {
      "id": "cup_1",
      "name": "Cup with loop handle",
      "dimensions": [
        0.11,
        0.07,
        0.08
      ],
      "position": [
        -0.25,
        0.13,
        0.2405
      ],
      "rgba": [
        0.16,
        0.46,
        0.74,
        1
      ],
      "image_bbox": [
        0.359170218706131,
        0.23258190393447875,
        0.4586662447452545,
        0.36999995470047
      ],
      "details": "Hollow walls, base and a separate visible loop handle."
    },
    {
      "id": "scissors_1",
      "name": "Scissors in a fixed rigid pose",
      "dimensions": [
        0.16,
        0.09,
        0.008
      ],
      "position": [
        -0.04,
        0.13,
        0.2045
      ],
      "rgba": [
        0.12,
        0.43,
        0.24,
        1
      ],
      "image_bbox": [
        0.46800225019454955,
        0.35918890476226806,
        0.6175001358985901,
        0.4723154401779175
      ],
      "details": "Two tapered blades, two finger loops, bridges and a pivot; no articulated cutting."
    },
    {
      "id": "remote_1",
      "name": "Remote control",
      "dimensions": [
        0.056,
        0.145,
        0.022
      ],
      "position": [
        0.23,
        0.1,
        0.2115
      ],
      "rgba": [
        0.07,
        0.075,
        0.085,
        1
      ],
      "image_bbox": [
        0.6411319279670715,
        0.46627675533294677,
        0.7655350065231323,
        0.5885209238529205
      ],
      "details": "Rounded housing, red power key and fifteen individual buttons."
    },
    {
      "id": "container_1",
      "name": "Asymmetric narrow-neck container",
      "dimensions": [
        0.1,
        0.07,
        0.094
      ],
      "position": [
        -0.17,
        -0.13,
        0.2455
      ],
      "rgba": [
        0.86,
        0.42,
        0.12,
        1
      ],
      "image_bbox": [
        0.2794534170627594,
        0.3969729447364807,
        0.3703588938713074,
        0.526876608133316
      ],
      "details": "Freeform ring-profile mesh with asymmetry, shoulders, narrow neck and cap."
    },
    {
      "id": "nut_1",
      "name": "Hexagonal nut",
      "dimensions": [
        0.064,
        0.056,
        0.018
      ],
      "position": [
        0.14,
        -0.13,
        0.2095
      ],
      "rgba": [
        0.6,
        0.63,
        0.67,
        1
      ],
      "image_bbox": [
        0.49381040573120116,
        0.5727068090438843,
        0.5628565645217896,
        0.6495781934261322
      ],
      "details": "Six-sided outer body and central aperture; convex collision fills the aperture."
    }
  ],
  "notes": [
    "Synthetic Blender-rendered reference, not a real photograph or evidence of image recognition.",
    "These labels are examples rather than a registered supported-object list. The agent writes new geometry for other rigid objects.",
    "Dimensions, mass and friction are authoring assumptions. Scissors remain one rigid object in their displayed pose.",
    "One convex hull per object fills holes and concavities. Manual Blender review and final scene confirmation are pending."
  ],
  "source_sha256": "c375c9b886733e1da6ca78446ed9b174514244e689a87066e7832b147a165b14"
}